{
  "ir_version": "0.3",
  "metadata": {
    "name": "TCM Intake Triage",
    "description": "Classify a TCM intake document, extract structured patient-facing fields, route by validation and confidence outcome.",
    "owner": "clinic-ops",
    "rationale": "Shadow TCM archetype for intake and triage workflows. Keeps the original classify / code extract / condition route skeleton while testing high-PII healthcare-adjacent copy."
  },
  "registry_ref": {
    "registry_version": "sha:0000000",
    "tools": [],
    "datasets": [],
    "credentials": []
  },
  "policy": {
    "default_timeout_s": 60,
    "default_retry": { "max_attempts": 2, "backoff": "exponential", "retry_on": ["5xx", "timeout"] },
    "agent_budget": { "max_iterations": 10, "max_tokens": 50000, "max_wall_clock_s": 300 }
  },
  "inputs": [
    { "name": "document", "type": "file", "required": true }
  ],
  "outputs": [
    { "name": "status", "type": "string" },
    { "name": "fields", "type": "json" },
    { "name": "issues", "type": "string[]" }
  ],
  "nodes": [
    { "id": "start", "type": "trigger", "mode": "manual", "rationale": "Manual intake review starts from an uploaded patient questionnaire or visit note." },
    {
      "id": "classify",
      "type": "llm",
      "rationale": "Classify the intake document so the deterministic extractor can apply the right field map.",
      "model": "configured-planner-model",
      "system_prompt": "Classify the TCM intake document. Return only the JSON object.",
      "prompt": "Document:\n${input.document}\n\nClassify as one of: first_visit_intake, followup_note, lab_attachment, other. Provide confidence in [0,1].",
      "temperature": 0,
      "output_schema": {
        "type": "object",
        "required": ["category", "confidence"],
        "properties": {
          "category":   { "type": "string", "enum": ["first_visit_intake", "followup_note", "lab_attachment", "other"] },
          "confidence": { "type": "number", "minimum": 0, "maximum": 1 }
        }
      }
    },
    {
      "id": "extract",
      "type": "code",
      "rationale": "Extract structured triage fields while keeping validation deterministic and reviewable.",
      "language": "python",
      "source": "from extractors import extract\nresult = extract(document, classify['category'])\nreturn { 'fields': result.fields, 'valid': result.valid, 'issues': result.issues }",
      "inputs": {
        "document": "${input.document}",
        "classify": "${classify}"
      },
      "output_schema": {
        "type": "object",
        "required": ["fields", "valid", "issues"],
        "properties": {
          "fields": { "type": "object" },
          "valid":  { "type": "boolean" },
          "issues": { "type": "array", "items": { "type": "string" } }
        }
      }
    },
    {
      "id": "route",
      "type": "condition",
      "rationale": "Route clean intake records forward and send uncertain or invalid records to human review.",
      "branches": [
        { "when": "${extract.valid} == true",                                   "next": "approved_out" },
        { "when": "${extract.valid} == false && ${classify.confidence} < 0.7", "next": "review_out" }
      ],
      "default": "rejected_out"
    },
    {
      "id": "approved_out",
      "type": "output",
      "rationale": "Approved records can proceed to clinician-facing triage preparation.",
      "bindings": {
        "status": "approved",
        "fields": "${extract.fields}",
        "issues": "${extract.issues}"
      }
    },
    {
      "id": "review_out",
      "type": "output",
      "rationale": "Low-confidence or ambiguous records require staff review before use.",
      "bindings": {
        "status": "needs_review",
        "fields": "${extract.fields}",
        "issues": "${extract.issues}"
      }
    },
    {
      "id": "rejected_out",
      "type": "output",
      "rationale": "Invalid records are rejected with issues preserved for follow-up.",
      "bindings": {
        "status": "rejected",
        "fields": "${extract.fields}",
        "issues": "${extract.issues}"
      }
    }
  ],
  "edges": [
    { "from": "start",    "to": "classify" },
    { "from": "classify", "to": "extract" },
    { "from": "extract",  "to": "route" }
  ]
}
