{
  "ir_version": "0.3",
  "metadata": {
    "name": "TCM Follow-up",
    "description": "Outline follow-up needs, run a bounded agentic review per item with deterministic fallback, then consolidate a staff-reviewed follow-up draft.",
    "owner": "clinic-ops",
    "rationale": "Shadow TCM follow-up archetype for bounded agent governance and fallback behavior. Keeps the original outline / loop / agent island / consolidate skeleton."
  },
  "registry_ref": {
    "registry_version": "sha:0000000",
    "tools": ["patient_history_lookup", "clinic_policy_lookup"],
    "datasets": [],
    "credentials": []
  },
  "policy": {
    "default_timeout_s": 60,
    "default_retry": { "max_attempts": 2, "backoff": "exponential", "retry_on": ["5xx", "timeout"] },
    "agent_budget": { "max_iterations": 10, "max_tokens": 50000, "max_wall_clock_s": 300 }
  },
  "inputs": [
    { "name": "topic", "type": "string", "required": true }
  ],
  "outputs": [
    { "name": "report",  "type": "string" },
    { "name": "sources", "type": "string[]" }
  ],
  "nodes": [
    { "id": "start", "type": "trigger", "mode": "manual", "rationale": "Manual trigger lets staff start follow-up drafting from a patient or visit context." },
    {
      "id": "outline",
      "type": "llm",
      "rationale": "Break the follow-up context into bounded subtopics so each review step stays small.",
      "model": "configured-planner-model",
      "system_prompt": "You break TCM follow-up work into focused subtopics for staff-reviewed investigation.",
      "prompt": "Follow-up topic: ${input.topic}\n\nReturn 3-5 subtopics covering distinct follow-up needs.",
      "temperature": 0.4,
      "output_schema": {
        "type": "object",
        "required": ["subtopics"],
        "properties": {
          "subtopics": { "type": "array", "items": { "type": "string" }, "minItems": 3, "maxItems": 5 }
        }
      }
    },
    {
      "id": "research_loop",
      "type": "loop",
      "rationale": "Run the same bounded review pattern for each follow-up subtopic.",
      "over": "${outline.subtopics}",
      "as": "subtopic",
      "max_iterations": 5,
      "collect": "${research_outcome}",
      "body": [
        {
          "id": "research_agent",
          "type": "agent",
          "rationale": "Use bounded tools to gather visit-history and clinic-policy context for one follow-up subtopic.",
          "model": "configured-planner-model",
          "tools": ["patient_history_lookup", "clinic_policy_lookup"],
          "system_prompt": "Research the assigned follow-up subtopic. Do not provide diagnosis or treatment changes; prepare staff-review context only.",
          "input_schema": {
            "type": "object",
            "required": ["subtopic"],
            "properties": { "subtopic": { "type": "string" } }
          },
          "output_schema": {
            "type": "object",
            "required": ["findings", "sources"],
            "properties": {
              "findings": { "type": "string" },
              "sources":  { "type": "array", "items": { "type": "string" } }
            }
          },
          "inputs": { "subtopic": "${subtopic}" },
          "budget": { "max_iterations": 8, "max_tokens": 30000, "max_wall_clock_s": 300 },
          "on_budget_exhausted": "fallback",
          "fallback_edge": "fallback_summary"
        },
        {
          "id": "fallback_summary",
          "type": "llm",
          "rationale": "Provide a conservative fallback summary when tool-backed context is unavailable.",
          "model": "configured-small-model",
          "system_prompt": "Produce a cautious best-effort follow-up summary when tools are unavailable. Mark uncertainty explicitly.",
          "prompt": "Subtopic: ${subtopic}\n\nWrite a low-confidence staff-review note; cite no sources (return empty array).",
          "output_schema": {
            "type": "object",
            "required": ["findings", "sources"],
            "properties": {
              "findings": { "type": "string" },
              "sources":  { "type": "array", "items": { "type": "string" } }
            }
          }
        },
        {
          "id": "research_outcome",
          "type": "code",
          "rationale": "Normalize the agent or fallback result into a consistent collected item.",
          "language": "python",
          "source": "if research_agent is not None:\n    return { 'findings': research_agent['findings'], 'sources': research_agent['sources'], 'confidence': 'high' }\nreturn { 'findings': fallback_summary['findings'], 'sources': fallback_summary['sources'], 'confidence': 'low' }",
          "inputs": {
            "research_agent":   "${research_agent}",
            "fallback_summary": "${fallback_summary}"
          },
          "output_schema": {
            "type": "object",
            "required": ["findings", "sources", "confidence"],
            "properties": {
              "findings":   { "type": "string" },
              "sources":    { "type": "array", "items": { "type": "string" } },
              "confidence": { "type": "string", "enum": ["high", "low"] }
            }
          }
        }
      ]
    },
    {
      "id": "consolidate",
      "type": "llm",
      "rationale": "Synthesize per-subtopic notes into one staff-reviewed follow-up draft.",
      "model": "configured-planner-model",
      "system_prompt": "You synthesize TCM follow-up context into a staff-reviewed draft. Note low-confidence sections and avoid autonomous clinical advice.",
      "prompt": "Follow-up topic: ${input.topic}\n\nPer-subtopic findings:\n${research_loop.collected}\n\nProduce a follow-up draft and a deduplicated source list.",
      "temperature": 0.3,
      "output_schema": {
        "type": "object",
        "required": ["report", "sources"],
        "properties": {
          "report":  { "type": "string" },
          "sources": { "type": "array", "items": { "type": "string" } }
        }
      }
    },
    {
      "id": "out",
      "type": "output",
      "rationale": "Expose the consolidated follow-up draft and source list for staff review.",
      "bindings": {
        "report":  "${consolidate.report}",
        "sources": "${consolidate.sources}"
      }
    }
  ],
  "edges": [
    { "from": "start",         "to": "outline" },
    { "from": "outline",       "to": "research_loop" },
    { "from": "research_loop", "to": "consolidate" },
    { "from": "consolidate",   "to": "out" }
  ]
}
