{
  "ir_version": "0.3",
  "metadata": {
    "name": "Clinic Ops Summary",
    "description": "Scheduled clinic operations digest: pull yesterday's appointment and service metrics, transform, summarize, and post to an internal channel.",
    "owner": "clinic-ops",
    "rationale": "Shadow TCM operations archetype. Preserves the scheduled ETL / HTTP / code / LLM / HTTP notification skeleton while moving the business text to clinic operations."
  },
  "registry_ref": {
    "registry_version": "sha:0000000",
    "tools": [],
    "datasets": [],
    "credentials": ["clinic_ops_api", "clinic_ops_webhook"]
  },
  "policy": {
    "default_timeout_s": 60,
    "default_retry": { "max_attempts": 3, "backoff": "exponential", "retry_on": ["5xx", "timeout", "rate_limit"] },
    "agent_budget": { "max_iterations": 10, "max_tokens": 50000, "max_wall_clock_s": 300 }
  },
  "inputs": [],
  "outputs": [
    { "name": "delivered", "type": "boolean" },
    { "name": "summary",   "type": "string" }
  ],
  "nodes": [
    {
      "id": "start",
      "type": "trigger",
      "mode": "schedule",
      "rationale": "Run every morning so clinic operators start with a current operations digest.",
      "schedule": "0 9 * * *"
    },
    {
      "id": "pull",
      "type": "http",
      "rationale": "Fetch the prior day's clinic operations data from the locked internal source.",
      "method": "GET",
      "url": "https://api.example.com/clinic/yesterday",
      "credential": "clinic_ops_api",
      "headers": { "Accept": "application/json" },
      "timeout_s": 30,
      "retry": { "max_attempts": 5, "backoff": "exponential", "retry_on": ["5xx", "timeout", "rate_limit"] }
    },
    {
      "id": "transform",
      "type": "code",
      "rationale": "Normalize appointment, no-show, service, and inventory signals into a compact summary table.",
      "language": "python",
      "source": "records = [{'id': r['id'], 'visits': r['visits'], 'service': r['service']} for r in pull['body']]\nreturn { 'records': records, 'count': len(records) }",
      "inputs": { "pull": "${pull}" },
      "output_schema": {
        "type": "object",
        "required": ["records", "count"],
        "properties": {
          "records": { "type": "array" },
          "count":   { "type": "integer", "minimum": 0 }
        }
      }
    },
    {
      "id": "summarize",
      "type": "llm",
      "rationale": "Convert normalized metrics into a concise manager-facing clinic operations summary.",
      "model": "configured-planner-model",
      "system_prompt": "You write concise clinic operations digests for managers. Do not include patient-identifying details.",
      "prompt": "Summarize ${transform.count} clinic operation records:\n${transform.records}\n\nReturn a 3-sentence executive summary and 5 highlight bullets.",
      "temperature": 0.3,
      "output_schema": {
        "type": "object",
        "required": ["summary", "highlights"],
        "properties": {
          "summary":    { "type": "string" },
          "highlights": { "type": "array", "items": { "type": "string" }, "minItems": 1, "maxItems": 5 }
        }
      }
    },
    {
      "id": "write",
      "type": "http",
      "rationale": "Post the approved operations digest into the configured internal clinic channel.",
      "method": "POST",
      "url": "https://hooks.example.com/clinic-ops/digest",
      "credential": "clinic_ops_webhook",
      "body": {
        "text":       "${summarize.summary}",
        "highlights": "${summarize.highlights}"
      },
      "idempotency_key": "clinic-ops-digest-${start.run_id}",
      "timeout_s": 15,
      "retry": { "max_attempts": 3, "backoff": "exponential", "retry_on": ["5xx", "timeout"] }
    },
    {
      "id": "out",
      "type": "output",
      "rationale": "Expose delivery status and summary text for audit and downstream reporting.",
      "bindings": {
        "delivered": "true",
        "summary":   "${summarize.summary}"
      }
    }
  ],
  "edges": [
    { "from": "start",     "to": "pull" },
    { "from": "pull",      "to": "transform" },
    { "from": "transform", "to": "summarize" },
    { "from": "summarize", "to": "write" },
    { "from": "write",     "to": "out" }
  ]
}
